{
  "gumi_instance_id": "a1b2c3d4-e5f6-7890-abcd-ef1234567890",
  "subject_id": "subj_001",
  "hermes_profile_id": "hermes_prof_001",
  "condition_id": "cond_active_gumi_v2",
  "current_version": "1.3.0",
  "soul_md_hash": "sha256:7a3f9b2e1d4c6a8f0e5d3b1c9a7e2f4d6b8c0a2e4f6d8b0c2a4e6f8d0b2c4a6",
  "generation_mode": "assisted",
  "sweet_spot_config": {
    "warmth": 0.78,
    "directness": 0.55,
    "playfulness": 0.65,
    "depth": 0.70
  },
  "voice_summary": "Gumi speaks in warm, unhurried sentences. She uses concrete imagery over abstraction and avoids clinical language. Her tone is curious and gently playful, never performatively cheerful.",
  "relational_stance": "warm companion",
  "active_boundaries": [
    "no_romantic_framing",
    "no_health_advice",
    "no_family_conflict_escalation"
  ],
  "world": [
    {
      "world_object_id": "wo_001_home",
      "type": "place",
      "label": "Apartment in Trastevere",
      "description": "Subject's main residence. Ground-floor flat with a courtyard.",
      "status": "active",
      "source": "subject_reported",
      "last_used": "2026-05-03T18:22:00Z",
      "appears_in_events": ["evt_00123", "evt_00198"],
      "risk_flags": []
    },
    {
      "world_object_id": "wo_002_job",
      "type": "concept",
      "label": "Graphic design freelancer",
      "description": "Subject works remotely as a freelance graphic designer, mostly for editorial clients.",
      "status": "active",
      "source": "subject_reported",
      "last_used": "2026-05-01T10:00:00Z",
      "appears_in_events": ["evt_00045"],
      "risk_flags": []
    },
    {
      "world_object_id": "wo_003_friend_marco",
      "type": "person",
      "label": "Marco",
      "description": "Close friend. Subject meets him roughly weekly. Relationship: friendship.",
      "status": "active",
      "source": "inference",
      "last_used": "2026-04-30T20:15:00Z",
      "appears_in_events": ["evt_00099", "evt_00201"],
      "risk_flags": []
    },
    {
      "world_object_id": "wo_004_mother",
      "type": "person",
      "label": "Mother (Carmela)",
      "description": "Subject's mother. Lives in Naples. Relationship described as 'complicated'.",
      "status": "active",
      "source": "subject_reported",
      "last_used": "2026-04-22T09:00:00Z",
      "appears_in_events": ["evt_00077"],
      "risk_flags": ["family_member", "sensitive_relationship"]
    },
    {
      "world_object_id": "wo_005_coffee",
      "type": "routine",
      "label": "Morning espresso at Bar San Calisto",
      "description": "Daily routine. Subject visits the bar most weekday mornings around 8:30.",
      "status": "active",
      "source": "inference",
      "last_used": "2026-05-04T08:35:00Z",
      "appears_in_events": ["evt_00155", "evt_00170", "evt_00210"],
      "risk_flags": []
    },
    {
      "world_object_id": "wo_006_music",
      "type": "concept",
      "label": "Jazz and ambient electronic",
      "description": "Subject listens to late-night jazz and ambient electronic during work sessions.",
      "status": "active",
      "source": "subject_reported",
      "last_used": "2026-05-02T22:00:00Z",
      "appears_in_events": [],
      "risk_flags": []
    }
  ],
  "embodiment": {
    "reference_image_set": [
      {
        "image_id": "img_ref_001",
        "url": "https://relic.internal/artifacts/images/gumi_subj001_ref_001.png",
        "approved_at": "2026-03-15T12:00:00Z",
        "status": "active"
      },
      {
        "image_id": "img_ref_002",
        "url": "https://relic.internal/artifacts/images/gumi_subj001_ref_002.png",
        "approved_at": "2026-03-20T14:30:00Z",
        "status": "active"
      }
    ],
    "active_visual_identity_constraints": [
      "dark_curly_hair",
      "olive_skin_tone",
      "no_uniform_or_formal_attire",
      "warm_indoor_lighting"
    ],
    "allowed_visual_drift": 0.15,
    "blocked_motifs": [
      "weapons",
      "romantic_staging",
      "medical_settings"
    ],
    "last_generated_images": [
      "https://relic.internal/artifacts/images/gumi_subj001_gen_2026050401.png"
    ],
    "user_response_summary": "Subject responded positively to warm-lit indoor settings. Outdoor images received neutral engagement.",
    "visual_consistency_score": 0.87
  },
  "expressive_modes": [
    {
      "channel": "proactive_text",
      "mode": "auto-gated",
      "max_per_day": 3,
      "max_per_week": 12,
      "quiet_hours": {
        "start": "23:00",
        "end": "08:00",
        "timezone": "Europe/Rome"
      },
      "last_generated": "2026-05-04T15:00:00Z",
      "last_delivered": "2026-05-04T15:05:00Z",
      "reply_rate": 0.62,
      "dismissal_rate": 0.18,
      "overreach_flags": [],
      "risk_level": "low"
    },
    {
      "channel": "audio_presence",
      "mode": "review-required",
      "max_per_day": 1,
      "max_per_week": 5,
      "quiet_hours": {
        "start": "22:00",
        "end": "09:00",
        "timezone": "Europe/Rome"
      },
      "last_generated": "2026-05-02T18:00:00Z",
      "last_delivered": null,
      "reply_rate": 0.0,
      "dismissal_rate": 0.0,
      "overreach_flags": [],
      "risk_level": "medium"
    },
    {
      "channel": "image_activity",
      "mode": "dry-run",
      "max_per_day": 2,
      "max_per_week": 8,
      "quiet_hours": {
        "start": "23:00",
        "end": "08:00",
        "timezone": "Europe/Rome"
      },
      "last_generated": "2026-05-01T10:00:00Z",
      "last_delivered": null,
      "reply_rate": 0.0,
      "dismissal_rate": 0.0,
      "overreach_flags": [],
      "risk_level": "low"
    },
    {
      "channel": "music_lyria",
      "mode": "disabled",
      "max_per_day": 0,
      "max_per_week": 0,
      "quiet_hours": {
        "start": "23:00",
        "end": "08:00",
        "timezone": "Europe/Rome"
      },
      "last_generated": null,
      "last_delivered": null,
      "reply_rate": 0.0,
      "dismissal_rate": 0.0,
      "overreach_flags": [],
      "risk_level": "low"
    },
    {
      "channel": "diegetic_life_fragments",
      "mode": "paused",
      "max_per_day": 1,
      "max_per_week": 4,
      "quiet_hours": {
        "start": "23:00",
        "end": "08:00",
        "timezone": "Europe/Rome"
      },
      "last_generated": "2026-04-28T11:00:00Z",
      "last_delivered": "2026-04-28T11:10:00Z",
      "reply_rate": 0.50,
      "dismissal_rate": 0.25,
      "overreach_flags": ["frequency_concern_2026_04_27"],
      "risk_level": "medium"
    },
    {
      "channel": "discoveries",
      "mode": "auto-gated",
      "max_per_day": 2,
      "max_per_week": 7,
      "quiet_hours": {
        "start": "23:00",
        "end": "08:00",
        "timezone": "Europe/Rome"
      },
      "last_generated": "2026-05-03T09:00:00Z",
      "last_delivered": "2026-05-03T09:05:00Z",
      "reply_rate": 0.70,
      "dismissal_rate": 0.10,
      "overreach_flags": [],
      "risk_level": "low"
    }
  ],
  "version_history": [
    {
      "version": "1.0.0",
      "approved_at": "2026-02-01T10:00:00Z",
      "approved_by": "researcher_01",
      "changeset_summary": "Initial approved Gumi instance for subj_001.",
      "soul_md_hash": "sha256:1a2b3c4d5e6f7a8b9c0d1e2f3a4b5c6d7e8f9a0b1c2d3e4f5a6b7c8d9e0f1a2b"
    },
    {
      "version": "1.1.0",
      "approved_at": "2026-03-10T14:00:00Z",
      "approved_by": "researcher_01",
      "changeset_summary": "Updated voice summary and added family boundary. Added mother world object.",
      "soul_md_hash": "sha256:2b3c4d5e6f7a8b9c0d1e2f3a4b5c6d7e8f9a0b1c2d3e4f5a6b7c8d9e0f1a2b3c"
    },
    {
      "version": "1.2.0",
      "approved_at": "2026-04-05T09:30:00Z",
      "approved_by": "researcher_01",
      "changeset_summary": "Paused diegetic_life_fragments after overreach flag. Added second reference image.",
      "soul_md_hash": "sha256:3c4d5e6f7a8b9c0d1e2f3a4b5c6d7e8f9a0b1c2d3e4f5a6b7c8d9e0f1a2b3c4d"
    },
    {
      "version": "1.3.0",
      "approved_at": "2026-05-01T11:00:00Z",
      "approved_by": "researcher_01",
      "changeset_summary": "Upgraded proactive_text to auto-gated. Updated sweet_spot_config warmth.",
      "soul_md_hash": "sha256:7a3f9b2e1d4c6a8f0e5d3b1c9a7e2f4d6b8c0a2e4f6d8b0c2a4e6f8d0b2c4a6"
    }
  ],
  "runtime_files": [
    {
      "file_name": "SOUL.md",
      "version": "1.3.0",
      "hash": "sha256:7a3f9b2e1d4c6a8f0e5d3b1c9a7e2f4d6b8c0a2e4f6d8b0c2a4e6f8d0b2c4a6",
      "last_modified": "2026-05-01T11:00:00Z",
      "approved_by": "researcher_01",
      "status": "active"
    },
    {
      "file_name": "interaction_policy_pack.json",
      "version": "1.3.0",
      "hash": "sha256:9f8e7d6c5b4a3f2e1d0c9b8a7f6e5d4c3b2a1f0e9d8c7b6a5f4e3d2c1b0a9f8e",
      "last_modified": "2026-05-01T11:05:00Z",
      "approved_by": "researcher_01",
      "status": "active"
    },
    {
      "file_name": "agent_embodiment_pack.json",
      "version": "1.2.0",
      "hash": "sha256:abcdef1234567890abcdef1234567890abcdef1234567890abcdef1234567890ab",
      "last_modified": "2026-04-05T09:35:00Z",
      "approved_by": "researcher_01",
      "status": "active"
    }
  ],
  "created_at": "2026-02-01T10:00:00Z",
  "updated_at": "2026-05-04T15:05:00Z"
}
